{
  "schemaVersion": "G1A-BUNDLE-MANIFEST-V1",
  "bundleStatus": "TEMPLATE",
  "closureStatus": "PENDING",
  "bundleId": "G1A-DD-FR-002-TEMPLATE-01",
  "createdAtUtc": "PENDING",
  "evidenceOwner": "PENDING",
  "operator": "PENDING",
  "reviewer": "PENDING",
  "targetMachineAlias": "PENDING",
  "redactionReference": "PENDING",
  "retentionReference": "PENDING",
  "accessReference": "PENDING",
  "locationReference": "PENDING",
  "repositoryBinding": { "status": "PENDING", "reference": "PENDING" },
  "sourceBinding": { "status": "PENDING", "reference": "PENDING" },
  "toolchainBinding": { "status": "PENDING", "reference": "PENDING" },
  "buildBinding": { "status": "PENDING", "reference": "PENDING" },
  "allowlistStatus": "PENDING",
  "callTraceStatus": "PENDING",
  "environmentStatus": "PENDING",
  "observationsStatus": "PENDING",
  "reviewStatus": "PENDING",
  "gapsStatus": "PENDING",
  "phase2AAuthorized": false,
  "displayMutationAllowed": false,
  "maxBundleBytes": 8388608,
  "oversizeDisposition": "INVALID_BUNDLE_SEPARATE_FAILED_RUN",
  "artifacts": [],
  "totalArtifactBytes": 0,
  "bundleContentSha256": "fe28cb9cf61ab71d18b86c302d187dbcc398e264f23c38a5a94bcd8c99c07aac"
}
